{
  "review_id": "REVIEW_20260329_211812_270606bf",
  "timestamp": "2026-03-30T03:18:12.774001+00:00",
  "status": "healthy",
  "source_scripts": "SCRIPT_20260329_211619_4b4d93c6",
  "reviewed_scripts": [
    {
      "script_id": "SCR_66e17c93a613",
      "trend_title": "AI system learns to keep warehouse robot traffic running smoothly",
      "template_id": "tutorial-standard",
      "review_status": "approved",
      "scores": {
        "hook_strength": 8,
        "content_depth": 9,
        "structure_flow": 10,
        "differentiation": 9,
        "overall": 9
      },
      "recommendations": [],
      "approved_sections": [
        "hook",
        "intro",
        "step_1",
        "step_2",
        "step_3",
        "demo",
        "tips",
        "cta"
      ],
      "revision_needed": [],
      "production_ready": true
    },
    {
      "script_id": "SCR_886edf2f2019",
      "trend_title": "Sora\u2019s shutdown could be a reality check moment for AI video",
      "template_id": "news-standard",
      "review_status": "approved",
      "scores": {
        "hook_strength": 5,
        "content_depth": 10,
        "structure_flow": 10,
        "differentiation": 9,
        "overall": 8
      },
      "recommendations": [],
      "approved_sections": [
        "hook",
        "context",
        "details",
        "analysis",
        "takeaway",
        "cta"
      ],
      "revision_needed": [],
      "production_ready": true
    },
    {
      "script_id": "SCR_54d7b48d50d7",
      "trend_title": "Bluesky leans into AI with Attie, an app for building custom feeds",
      "template_id": "news-standard",
      "review_status": "approved",
      "scores": {
        "hook_strength": 8,
        "content_depth": 10,
        "structure_flow": 10,
        "differentiation": 9,
        "overall": 9
      },
      "recommendations": [],
      "approved_sections": [
        "hook",
        "context",
        "details",
        "analysis",
        "takeaway",
        "cta"
      ],
      "revision_needed": [],
      "production_ready": true
    }
  ],
  "summary": {
    "total_reviewed": 3,
    "approved": 3,
    "needs_revision": 0,
    "rejected": 0,
    "average_score": 8.7
  },
  "meta": {
    "version": "1.0.0",
    "service": "script_reviewer",
    "story_id": "SKYBEAM-STORY-012",
    "review_count": 3,
    "degraded": false
  }
}